{
  "schema_version": "1.0",
  "session_id": "11111111-1111-4111-8111-111111111111",
  "event_count": 1,
  "meaningful_event_count": 1,
  "timeline": [
    {
      "offset_seconds": 0,
      "event_type": "session_started",
      "summary": "Approved CAD session started",
      "source_event_id": "22222222-2222-4222-8222-222222222222"
    }
  ],
  "keyframes": [],
  "warnings": []
}
